{
  "$schema": "http://json-schema.org/draft-07/schema",
  "title": "Connector editor schema",
  "description": "Connector editor schema",
  "type": "object",
  "definitions": {
    "connector-parameters": {
      "type": "array",
      "items": {
        "type": "object",
        "properties": {
          "id": {
            "type": "string",
            "minLength": 1
          },
          "name": {
            "type": "string",
            "minLength": 1
          },
          "description": {
            "type": "string"
          },
          "type": {
            "type": "string"
          },
          "required": {
            "type": "boolean"
          },
          "model": {}
        },
        "required": [ "id", "name", "type" ]
      }
    },
    "connector-feature": {
      "type": "object",
      "additionalProperties" : false,
      "properties": {
        "id": {
          "type": "string",
          "minLength": 1
        },
        "name": {
          "type": "string",
          "minLength": 1
        },
        "description": {
          "type": "string"
        },
        "inputs": { "$ref": "#/definitions/connector-parameters" },
        "outputs": { "$ref": "#/definitions/connector-parameters" },
        "model": {
          "description": "JSON schema to map feature output",
          "type": "object",
          "additionalProperties": true
        }
      },
      "required": [ "id", "name" ]
    },
    "connector-config": {
      "type": "array",
      "items": {
        "type": "object",
        "additionalProperties" : false,
        "properties": {
          "name": {
            "type": "string",
            "minLength": 1
          },
          "description": {
            "type": "string"
          },
          "value": {
            "type": "string"
          },
          "required": {
            "type": "boolean"
          },
          "secure": {
            "type": "boolean"
          }
        },
        "required": [
          "name"
        ]
      }
    },
    "connector-error": {
      "type": "array",
      "items": {
        "type": "object",
        "additionalProperties": false,
        "properties": {
          "name": {
            "type": "string",
            "minLength": 1
          },
          "description": {
            "type": "string"
          },
          "code": {
            "type": "string"
          }
        },
        "required": [
          "name"
        ]
      }
    }
  },
  "additionalProperties" : false,
  "properties": {
    "id": {
      "description": "The connector id",
      "type": "string"
    },
    "name": {
      "description": "The connector's name",
      "type": "string",
      "minLength": 1,
      "maxLength": 100,
      "pattern": "^.{1,100}$"
    },
    "key": {
      "description": "The connector's key",
      "type": "string",
      "minLength": 1,
      "maxLength": 26,
      "pattern": "^[a-z]([-a-z0-9]{0,24}[a-z0-9])?$"
    },
    "description": {
      "description": "The connector's description",
      "type": "string"
    },
    "template": {
      "description": "The connector's template",
      "type": "string"
    },
    "actions" : {
      "type": "object",
      "additionalProperties": {
        "$ref": "#/definitions/connector-feature"
      },
      "default": {}
    },
    "events": {
      "type": "object",
      "additionalProperties": {
        "$ref": "#/definitions/connector-feature"
      },
      "default": {}
    },
    "config": {
      "$ref": "#/definitions/connector-config"
    },
    "errors": {
      "$ref": "#/definitions/connector-error"
    }
  },
  "required": [ "name" ]
}
