{"template":"agenticTaskConnector","name":"Agentic Task","description":"Connector for sending prompt to Agent Builder service in order to perform an agent execution.","actions":{"63acefbb-aec1-4ef9-866f-e1a8619ba333":{"outputs":[{"name":"processContext","description":"Process variables that provide additional context for the agent execution.","id":"3f4cd7d4-f3f5-6909-0543-03cf98270999","type":"json"},{"name":"response","description":"The response from the Agent Builder service","model":{"type":"string","example":["The concept of gravity is the force that pulls objects towards each other."]},"id":"c15aad39-bd0a-4cdf-9507-8bd7d71b715f","type":"string"},{"name":"tools","description":"The list of all tools invoked to accomplish the task.","model":{"type":"array","items":{"type":"object","properties":{"result":{"oneOf":[{"type":"string"},{"type":"object"}],"description":"The result returned by the tool"},"arguments":{"description":"The arguments passed to the tool","type":"object"},"toolName":{"description":"The name of the tool invoked","type":"string"}}}},"id":"c15aad39-bd0a-4cdf-9507-8bd7d71b7a1b","type":"array"},{"name":"memory","description":"The updated conversation history after the execution.","id":"c15aad39-bd0a-4cdf-9507-8bd7d71b7a2b","additionalProperties":{"type":"object","properties":{"metadata":{"type":"object"},"messageType":{"type":"string","enum":["USER","ASSISTANT"]},"text":{"type":"string"}}},"type":"object"}],"inputs":[{"name":"prompt","description":"The prompt to send to the Agent Builder service. For example: 'Explain the concept of gravity'","model":{"type":"string","example":["Explain the concept of gravity"]},"id":"8384f632-a4b6-44f2-a085-8dac76f57879","type":"string","required":false},{"name":"agent","description":"The reference to a defined AI agent model.","model":{"type":"string"},"id":"1e2ab5b2-d1e3-4787-8321-81af87059222","type":"agent","required":true},{"name":"memory","description":"The history of previous conversations with the agent grouped by conversation ID.","id":"1e2ab5b2-d1e3-4787-8321-81af87059444","additionalProperties":{"type":"object","properties":{"metadata":{"type":"object"},"messageType":{"type":"string","enum":["USER","ASSISTANT"]},"text":{"type":"string"}}},"type":"object","required":false},{"name":"memorySize","description":"The number of stored messaged in the memory for the current conversation.","id":"1e2ab5b2-d1e3-4787-8321-81af87059555","type":"integer","required":false},{"name":"contents","description":"Array of content references to be resolved at runtime, enriching the agent context.","model":{"type":"array","items":{"type":"content"}},"id":"2f3bc6c3-e2f4-5898-9432-92bf98160666","type":"array","required":false},{"name":"processContext","description":"Process variables that provide additional context for the agent execution.","id":"3f4cd7d4-f3f5-6909-0543-03cf98270777","additionalProperties":{"type":"string"},"type":"object","required":false}],"name":"AI_AGENT","description":"Send an agent execution request to Agent Builder service","id":"63acefbb-aec1-4ef9-866f-e1a8619ba333"}},"config":[],"errors":[{"code":"AGENT_NOT_FOUND","name":"AGENT_NOT_FOUND","description":"The specified agent was not found."},{"code":"INVALID_INPUT","name":"INVALID_INPUT","description":"The provided input is invalid."},{"code":"AUTHENTICATION_ERROR","name":"AUTHENTICATION_ERROR","description":"Authentication error occurred."},{"code":"BLOCKED_BY_GUARDRAIL","name":"BLOCKED_BY_GUARDRAIL","description":"Request content violates guardrail policy."},{"code":"TIMEOUT_ERROR","name":"TIMEOUT_ERROR","description":"Request timed out."},{"code":"INTERNAL_ERROR","name":"INTERNAL_ERROR","description":"An error occurred while invoking the agent."},{"code":"INTERNAL_ERROR","name":"INTERNAL_ERROR","description":"An error occurred while invoking the agent."},{"code":"AGENT_BUILDER_UPLOAD_ERROR","name":"AGENT_BUILDER_UPLOAD_ERROR","description":"An error occurred while uploading a file to Agent Builder service."},{"code":"AGENT_PASSPORT_ERROR","name":"AGENT_PASSPORT_ERROR","description":"An error occurred while trying to validate the agent's passport. Check the configuration in Control Tower."}],"key":"agentic-task-wvis1"}
